{
  "$schema": "https://json-schema.org/draft/2020-12/schema",
  "$id": "https://github.com/DuhItzAniket/CloudScope/blob/master/core/resources/camera_model.schema.json",
  "title": "CloudScope camera model (cloudscope.camera_model/1)",
  "type": "object",
  "additionalProperties": false,
  "required": ["schema", "model", "image", "intrinsics", "distortion", "fit", "camera", "calibration_id", "calibrated_utc", "software"],
  "properties": {
    "schema": { "type": "string", "const": "cloudscope.camera_model/1" },
    "model": { "enum": ["opencv_pinhole", "opencv_fisheye"] },
    "image": {
      "type": "object",
      "additionalProperties": false,
      "required": ["width", "height"],
      "properties": {
        "width": { "type": "integer", "minimum": 1 },
        "height": { "type": "integer", "minimum": 1 }
      }
    },
    "intrinsics": {
      "type": "object",
      "additionalProperties": false,
      "required": ["fx", "fy", "cx", "cy"],
      "properties": {
        "fx": { "type": "number", "exclusiveMinimum": 0 },
        "fy": { "type": "number", "exclusiveMinimum": 0 },
        "cx": { "type": "number" },
        "cy": { "type": "number" }
      }
    },
    "distortion": { "type": "array", "items": { "type": "number" }, "minItems": 4, "maxItems": 5 },
    "fit": {
      "type": "object",
      "additionalProperties": false,
      "required": ["rms_px", "views", "board"],
      "properties": {
        "rms_px": { "type": "number", "minimum": 0 },
        "views": { "type": "integer", "minimum": 0 },
        "board": {
          "type": "object",
          "additionalProperties": false,
          "required": ["columns", "rows", "square_mm"],
          "properties": {
            "columns": { "type": "integer", "minimum": 3 },
            "rows": { "type": "integer", "minimum": 3 },
            "square_mm": { "type": "number", "exclusiveMinimum": 0 }
          }
        }
      }
    },
    "camera": {
      "type": "object",
      "additionalProperties": false,
      "required": ["id", "name"],
      "properties": {
        "id": { "type": "string" },
        "name": { "type": "string" }
      }
    },
    "calibration_id": { "type": "string" },
    "calibrated_utc": { "type": "string", "pattern": "^\\d{4}-\\d{2}-\\d{2}T\\d{2}:\\d{2}:\\d{2}\\.\\d{3}\\+00:00$" },
    "software": {
      "type": "object",
      "additionalProperties": false,
      "required": ["name", "version", "git_revision"],
      "properties": {
        "name": { "type": "string" },
        "version": { "type": "string" },
        "git_revision": { "type": "string" }
      }
    }
  }
}
